{
  "version": "1.2",
  "contract": {
    "artifact": "visual_direction_contract",
    "artifact_id": "ai-capital-flow-mortgage-ko/visual-direction",
    "revision": 1,
    "fingerprint": "sha256:ad20a2fa4f60fb41a0cbd862edfdad6e0f8b3775c5cc9e40304a908e9129f90e"
  },
  "viewer_journey": [
    {
      "id": "J3",
      "scene_ids": [
        "sc15",
        "sc16",
        "sc17",
        "sc18",
        "sc19"
      ],
      "viewer_goal": "같은 돈을 더 많은 채권이 나눠 가지니 금리를 올려야 한다"
    }
  ],
  "scenes": [
    {
      "scene_id": "sc15",
      "narrative_role": "explanation",
      "visual_mode": "model",
      "visual_model_id": "CAPITAL_FLOW",
      "beats": [
        {
          "id": "sc15-b1",
          "narration_anchor": "메타와 아마존이 채권을 쏟아내기 시작했습니다",
          "operation": "REVEAL",
          "target": "META",
          "action_id": "SC009/A01",
          "takeaway": "새 채권 등장",
          "anchor_id": "SC009/AN02",
          "contract_event_id": "SC009/E01"
        },
        {
          "id": "sc15-b2",
          "narration_anchor": "메타와 아마존이 채권을 쏟아내기 시작했습니다",
          "offset_seconds": 0.4,
          "operation": "REVEAL",
          "target": "AMZN",
          "action_id": "SC009/A01",
          "state_after_id": "SC009/S1",
          "takeaway": "선택지가 늘었다",
          "contract_event_id": "SC009/E01"
        }
      ]
    },
    {
      "scene_id": "sc16",
      "narrative_role": "explanation",
      "visual_mode": "model",
      "visual_model_id": "CAPITAL_FLOW",
      "beats": [
        {
          "id": "sc16-b1",
          "narration_anchor": "같은 돈이 더 많은 채권 사이로 나뉘어 흘러갑니다",
          "operation": "REVEAL",
          "target": "ALLOC_META",
          "action_id": "SC009/A02",
          "takeaway": "새 흐름이 생긴다",
          "anchor_id": "SC009/AN03",
          "contract_event_id": "SC009/E02"
        },
        {
          "id": "sc16-b2",
          "narration_anchor": "같은 돈이 더 많은 채권 사이로 나뉘어 흘러갑니다",
          "operation": "REVEAL",
          "target": "ALLOC_AMZN",
          "action_id": "SC009/A02",
          "takeaway": "새 흐름이 생긴다",
          "anchor_id": "SC009/AN03",
          "contract_event_id": "SC009/E02"
        },
        {
          "id": "sc16-b3",
          "narration_anchor": "나뉘어 흘러갑니다",
          "operation": "EXPAND",
          "target": "ALLOC_UST",
          "params": {
            "attr": "value",
            "to": 40
          },
          "action_id": "SC009/A02",
          "takeaway": "국채로 가던 돈이 줄고",
          "contract_event_id": "SC009/E02",
          "sync_group": "sc16-realloc"
        },
        {
          "id": "sc16-b4",
          "narration_anchor": "나뉘어 흘러갑니다",
          "operation": "EXPAND",
          "target": "ALLOC_META",
          "params": {
            "attr": "value",
            "to": 10
          },
          "action_id": "SC009/A02",
          "takeaway": "메타로 일부가",
          "contract_event_id": "SC009/E02",
          "sync_group": "sc16-realloc"
        },
        {
          "id": "sc16-b5",
          "narration_anchor": "나뉘어 흘러갑니다",
          "operation": "EXPAND",
          "target": "ALLOC_AMZN",
          "params": {
            "attr": "value",
            "to": 10
          },
          "action_id": "SC009/A02",
          "state_after_id": "SC009/S2",
          "takeaway": "아마존으로 일부가 — 총량은 그대로",
          "contract_event_id": "SC009/E02",
          "sync_group": "sc16-realloc"
        }
      ]
    },
    {
      "scene_id": "sc17",
      "narrative_role": "explanation",
      "visual_mode": "model",
      "visual_model_id": "CAPITAL_FLOW",
      "beats": [
        {
          "id": "sc17-b1",
          "narration_anchor": "더 높은 금리를 약속해야 했습니다",
          "operation": "REVEAL",
          "target": "YIELD_META",
          "action_id": "SC009/A03",
          "takeaway": "요구수익률 표시",
          "anchor_id": "SC009/AN04",
          "contract_event_id": "SC009/E03"
        },
        {
          "id": "sc17-b2",
          "narration_anchor": "더 높은 금리를 약속해야 했습니다",
          "offset_seconds": 0.5,
          "operation": "EXPAND",
          "target": "YIELD_META",
          "params": {
            "attr": "value",
            "to": 5.2
          },
          "action_id": "SC009/A03",
          "state_after_id": "SC009/S3",
          "takeaway": "4.5% → 5.2%",
          "contract_event_id": "SC009/E03"
        }
      ]
    },
    {
      "scene_id": "sc18",
      "narrative_role": "evidence",
      "visual_mode": "evidence",
      "evidence_intent": "은행 혼합형 주담대 금리표 원본 캡처"
    },
    {
      "scene_id": "sc19",
      "narrative_role": "immersion",
      "visual_mode": "reality",
      "broll_intent": {
        "subject": "거대한 데이터센터 외관 와이드",
        "continuity": "place"
      }
    }
  ]
}
