{
  "version": "1.2",
  "contract": {
    "artifact": "visual_direction_contract",
    "artifact_id": "ai-capital-flow-mortgage-ko/visual-direction",
    "revision": 1,
    "fingerprint": "sha256:2649e3464b5584d45525d7f8c2b0e3b1ed14bf6fbcf11d4ce477ef9a24571a6a"
  },
  "viewer_journey": [
    {
      "id": "J3",
      "scene_ids": [
        "sc15",
        "sc16",
        "sc17",
        "sc18",
        "sc19"
      ],
      "viewer_goal": "투자자는 여러 채권을 비교한다"
    }
  ],
  "scenes": [
    {
      "scene_id": "sc15",
      "narrative_role": "explanation",
      "visual_mode": "model",
      "visual_model_id": "CAPITAL_FLOW",
      "beats": [
        {
          "id": "sc15-b1",
          "narration_anchor": "메타와 아마존이 채권을 쏟아내기 시작했습니다",
          "operation": "REVEAL",
          "target": "META",
          "action_id": "SC009/A01",
          "takeaway": "새 채권 등장",
          "anchor_id": "SC009/AN02",
          "contract_event_id": "SC009/E01"
        },
        {
          "id": "sc15-b2",
          "narration_anchor": "메타와 아마존이 채권을 쏟아내기 시작했습니다",
          "offset_seconds": 0.4,
          "operation": "REVEAL",
          "target": "AMZN",
          "action_id": "SC009/A01",
          "state_after_id": "SC009/S1",
          "takeaway": "선택지가 늘었다",
          "contract_event_id": "SC009/E01"
        }
      ]
    },
    {
      "scene_id": "sc16",
      "narrative_role": "comparison",
      "visual_mode": "text",
      "viewer_takeaway": "국채 카드 vs 회사채 카드"
    },
    {
      "scene_id": "sc17",
      "narrative_role": "explanation",
      "visual_mode": "model",
      "visual_model_id": "CAPITAL_FLOW",
      "beats": [
        {
          "id": "sc17-b1",
          "narration_anchor": "더 높은 금리를 약속해야 했습니다",
          "operation": "REVEAL",
          "target": "YIELD_META",
          "action_id": "SC009/A03",
          "takeaway": "요구수익률 표시",
          "anchor_id": "SC009/AN04",
          "contract_event_id": "SC009/E03"
        },
        {
          "id": "sc17-b2",
          "narration_anchor": "더 높은 금리를 약속해야 했습니다",
          "offset_seconds": 0.5,
          "operation": "EXPAND",
          "target": "YIELD_META",
          "params": {
            "attr": "value",
            "to": 5.2
          },
          "action_id": "SC009/A03",
          "state_after_id": "SC009/S3",
          "takeaway": "4.5% → 5.2%",
          "contract_event_id": "SC009/E03"
        }
      ]
    },
    {
      "scene_id": "sc18",
      "narrative_role": "evidence",
      "visual_mode": "evidence",
      "evidence_intent": "은행 혼합형 주담대 금리표 원본 캡처"
    },
    {
      "scene_id": "sc19",
      "narrative_role": "immersion",
      "visual_mode": "reality",
      "broll_intent": {
        "subject": "거대한 데이터센터 외관 와이드",
        "continuity": "place"
      }
    }
  ]
}
